{"base_commit":"dbb98b4a40d1679800f7f85d0dad59ef60b5b790","benchmark_id":"swe_bench_live","created_at":"2024-10-25T15:34:26Z","environment_ref":"starryzhang/sweb.eval.x86_64.pydata_1776_xarray-9682","issue_id":"9682","issue_text":"Implement `DataTree.persist`\n> we're still missing an implementation for `DataTree.persist`, which I skipped mostly because I wasn't sure how to test that. \r\n\r\n_Originally posted by @TomNicholas in https://github.com/pydata/xarray/issues/9670#issuecomment-2435984448_\r\n            \n","issue_title":"Implement `DataTree.persist`","labels":["fail_to_pass_count:1","live","pass_to_pass_count:15104","repo:pydata/xarray"],"language":"python","official_test_entrypoint":"python -m pytest xarray/tests/test_datatree.py::TestDask::test_persist","repo_name":"pydata/xarray","schema_version":1,"source_url":"https://huggingface.co/datasets/SWE-bench/SWE-bench-Live","task_id":"pydata__xarray-9682"}
