{"base_commit":"8137ce10649526820efe752ff81eefabbea8ee23","benchmark_id":"swe_bench_live","created_at":"2025-01-14T13:40:13Z","environment_ref":"starryzhang/sweb.eval.x86_64.cyclotruc_1776_gitingest-134","issue_id":"134","issue_text":"bug: gitingest fails to resolve urls starting with \"gitingest.com\"\nOk so this one might sound a bit weird but from looking at the logs of gitingest.com I noticed many people were copy/pasting the gitingest URL into the input form for whatever reason\r\n\r\nAnd I think there's no good reason to not try to resolve those URLs since they probably came from a valid git host first\r\n\r\nThe fix should be very simple and I'm leaving this one on purpose for a contributor who would like to get started!\r\n\r\n1 - Create a testcase \r\n2 - Check it fails\r\n3 - Implement the changes\r\n4 - submit a PR\r\n\r\nDo not hesitate to ask if you want to take a stab at this and need any help onboarding the codebase\r\n\r\n\r\n\r\n\r\n\r\n\n","issue_title":"bug: gitingest fails to resolve urls starting with \"gitingest.com\"","labels":["fail_to_pass_count:2","live","pass_to_pass_count:57","repo:cyclotruc/gitingest"],"language":"python","official_test_entrypoint":"python -m pytest tests/query_parser/test_query_parser.py::test_parse_url_valid_http tests/query_parser/test_query_parser.py::test_parse_url_valid_https","repo_name":"cyclotruc/gitingest","schema_version":1,"source_url":"https://huggingface.co/datasets/SWE-bench/SWE-bench-Live","task_id":"cyclotruc__gitingest-134"}
