{"base_commit":"cffd4e0f86fefd4802349a9f9b19ed70934ea354","benchmark_id":"swe_bench_verified","created_at":"2020-12-12T18:18:38Z","environment_ref":"swebench/sweb.eval.x86_64.sympy__sympy-20590:latest","issue_id":"20590","issue_text":"Symbol instances have __dict__ since 1.7?\nIn version 1.6.2 Symbol instances had no `__dict__` attribute\r\n```python\r\n>>> sympy.Symbol('s').__dict__\r\n---------------------------------------------------------------------------\r\nAttributeError                            Traceback (most recent call last)\r\n<ipython-input-3-e2060d5eec73> in <module>\r\n----> 1 sympy.Symbol('s').__dict__\r\n\r\nAttributeError: 'Symbol' object has no attribute '__dict__'\r\n>>> sympy.Symbol('s').__slots__\r\n('name',)\r\n```\r\n\r\nThis changes in 1.7 where `sympy.Symbol('s').__dict__` now exists (and returns an empty dict)\r\nI may misinterpret this, but given the purpose of `__slots__`, I assume this is a bug, introduced because some parent class accidentally stopped defining `__slots__`.\n","issue_title":"Symbol instances have __dict__ since 1.7?","labels":["env_setup_commit:cffd4e0f86fefd4802349a9f9b19ed70934ea354","fail_to_pass_count:1","pass_to_pass_count:21","upstream_version:1.7"],"language":"python","official_test_entrypoint":"python -m swebench.harness.run_evaluation --instance_ids sympy__sympy-20590","repo_name":"sympy/sympy","schema_version":1,"source_url":"https://huggingface.co/datasets/princeton-nlp/SWE-bench_Verified","task_id":"sympy__sympy-20590"}
