{"base_commit":"9962393c20f2d1521aefdcf2562bef1380b4ccbe","benchmark_id":"rust_swe_bench","created_at":"2026-04-22T06:05:19.413922700Z","environment_ref":"cargo://clap-rs/clap@9962393c20f2","issue_id":"rs__clap_3874","issue_text":"Return help message as String for Command\n### Please complete the following tasks\n\n- [X] I have searched the [discussions](https://github.com/clap-rs/clap/discussions)\n- [X] I have searched the [open](https://github.com/clap-rs/clap/issues) and [rejected](https://github.com/clap-rs/clap/issues?q=is%3Aissue+label%3AS-wont-fix+is%3Aclosed) issues\n\n### Clap Version\n\n3.1.18\n\n### Describe your use case\n\nThe only way I could find to use the help message is to print out it to `Stdout`. In my use case I would like to get the help message as a String as I intend to not print it to `Stdout` directly.\n\n### Describe the solution you'd like\n\nA function that returns the help message as a String.\n\n### Alternatives, if applicable\n\n_No response_\n\n### Additional Context\n\n_No response_","issue_title":"Return help message as String for Command","labels":["repo:clap-rs/clap","rust"],"language":"rust","official_test_entrypoint":"cargo test --workspace --locked","repo_name":"clap-rs/clap","schema_version":1,"source_url":"https://huggingface.co/datasets/bytedance/Rust-SWE-bench","task_id":"clap-rs__clap_3874"}
