{"base_commit":"d532def93ed25a3831aef588627bd855a71af336","benchmark_id":"swe_bench_live","created_at":"2024-12-28T17:03:33Z","environment_ref":"starryzhang/sweb.eval.x86_64.streamlink_1776_streamlink-6361","issue_id":"6361","issue_text":"--show-matchers fails with lazy plugin loading\n### Checklist\n\n- [x] This is a bug report and not [a different kind of issue](https://github.com/streamlink/streamlink/issues/new/choose)\n- [x] [I have read the contribution guidelines](https://github.com/streamlink/streamlink/blob/master/CONTRIBUTING.md#contributing-to-streamlink)\n- [x] [I have checked the list of open and recently closed bug reports](https://github.com/streamlink/streamlink/issues?q=is%3Aissue+label%3A%22bug%22)\n- [x] [I have checked the commit log of the master branch](https://github.com/streamlink/streamlink/commits/master)\n\n### Collaboration\n\n- [x] [I will provide feedback should a pull request be opened with a fix for the problem](https://github.com/streamlink/streamlink/blob/master/CONTRIBUTING.md#pull-request-feedback)\n\n### Streamlink version\n\n7.1.0\n\n### Description\n\nNo idea why I didn't check that before tagging 7.1.0, but the newly added `--show-matchers` CLI argument (#6287) doesn't work if plugins are loaded lazily, namely in all regular installs. Editable installs (`pip install -e .`) always load all plugins, which is why this slipped through. The added tests also didn't make me aware of this. Annoying...\n\n```\n$ streamlink --show-matchers=twitch\nerror: Plugin not found\n```\n\n```\n$ streamlink twitch.tv/channel --show-matchers=twitch\n- name: player\n  pattern: https?://player\\.twitch\\.tv/\\?.+\n- name: clip\n  pattern: https?://(?:clips\\.twitch\\.tv|(?:[\\w-]+\\.)?twitch\\.tv/(?:[\\w-]+/)?clip)/(?P<clip_id>[^/?]+)\n- name: vod\n  pattern: https?://(?:[\\w-]+\\.)?twitch\\.tv/(?:[\\w-]+/)?v(?:ideos?)?/(?P<video_id>\\d+)\n- name: live\n  pattern: https?://(?:(?!clips\\.)[\\w-]+\\.)?twitch\\.tv/(?P<channel>(?!v(?:ideos?)?/|clip/)[^/?]+)/?(?:\\?|$)\n```\n\n\n### Debug log\n\n```text\n.\n```\n","issue_title":"--show-matchers fails with lazy plugin loading","labels":["fail_to_pass_count:2","live","pass_to_pass_count:6026","repo:streamlink/streamlink"],"language":"python","official_test_entrypoint":"python -m swebench.harness.run_evaluation --instance_ids streamlink__streamlink-6361 --dataset_name SWE-bench-Live","repo_name":"streamlink/streamlink","schema_version":1,"source_url":"https://huggingface.co/datasets/SWE-bench/SWE-bench-Live","task_id":"streamlink__streamlink-6361"}
