{"base_commit":"a55db38c061522a2b6397516df1eeedf2e8b4dc5","benchmark_id":"swe_bench_live","created_at":"2024-08-09T09:01:04Z","environment_ref":"starryzhang/sweb.eval.x86_64.jupyterlab_1776_jupyter-ai-943","issue_id":"943","issue_text":"New command to clear chat message history\n### Problem\r\n\r\n/clear command does not clear the default and ask chat handler memory. Given that it clears the window I would expect it to clear the memory as well.\r\n\r\nIf this is intentional, consider adding a new command (perhaps /new) to refresh the chat.\r\n\r\n### Proposed Solution\r\n\r\nHave /clear somehow call DefaultChatHandler.clear_memory and an equivalent in AskChatHandler. Would probably require altering BaseChatHandler to allow chat handlers to have access to other chat handlers. Could do so be by adding the AiExtension.settings[\"jai_chat_handlers\"] dict as a param in BaseChatHandler.\r\n\r\n### Additional context\r\n\r\nRelated to https://github.com/jupyterlab/jupyter-ai/issues/428. Although this seems to assume /clear clears the default chat handler memory, which it does not.\n","issue_title":"New command to clear chat message history","labels":["fail_to_pass_count:3","live","pass_to_pass_count:45","repo:jupyterlab/jupyter-ai"],"language":"python","official_test_entrypoint":"python -m swebench.harness.run_evaluation --instance_ids jupyterlab__jupyter-ai-943 --dataset_name SWE-bench-Live","repo_name":"jupyterlab/jupyter-ai","schema_version":1,"source_url":"https://huggingface.co/datasets/SWE-bench/SWE-bench-Live","task_id":"jupyterlab__jupyter-ai-943"}
