{"base_commit":"d8e868beb4ec60bceb2897477e8983fe10ad3b94","benchmark_id":"swe_bench_live","created_at":"2025-04-25T19:35:35Z","environment_ref":"starryzhang/sweb.eval.x86_64.falconry_1776_falcon-2450","issue_id":"2450","issue_text":"Support `ETag` for static files\nRender the `ETag` header when serving static files. We are already performing `.stat()` on the open file handle, so we should have the required data in order to build an ETag. We could use [the same algorithm](https://serverfault.com/questions/690341/algorithm-behind-nginx-etag-generation) as the popular Nginx web server.\r\n\r\nWhen serving, also check the [If-None-Match](https://developer.mozilla.org/en-US/docs/Web/HTTP/Headers/If-None-Match) header, and render `HTTP 304 Not Modified` if appropriate.\n","issue_title":"Support `ETag` for static files","labels":["fail_to_pass_count:12","live","pass_to_pass_count:3604","repo:falconry/falcon"],"language":"python","official_test_entrypoint":"python -m pytest tests/test_static.py::test_etag tests/test_static.py::test_if_none_match tests/test_static.py::test_if_none_match_precedence","repo_name":"falconry/falcon","schema_version":1,"source_url":"https://huggingface.co/datasets/SWE-bench/SWE-bench-Live","task_id":"falconry__falcon-2450"}
