{"base_commit":"c07eb2a6a04e0694d27e6b5e256cc219ac68af0c","benchmark_id":"swe_bench_live","created_at":"2024-10-28T22:49:10Z","environment_ref":"starryzhang/sweb.eval.x86_64.reflex-dev_1776_reflex-4256","issue_id":"4256","issue_text":"rx.Field pydantic validation issues\n**Describe the bug**\r\n\r\ncc @adhami3310 \r\n```\r\nE           pydantic.v1.error_wrappers.ValidationError: 1 validation error for TypedState\r\nE           base\r\nE             instance of Field expected (type=type_error.arbitrary_type; expected_arbitrary_type=Field)\r\n```\r\n\r\n\r\n**To Reproduce**\r\n\r\n```python\r\ndef test_typed_state() -> None:\r\n    class TypedState(rx.State):\r\n        base: rx.Field[str] = rx.field(\"\")\r\n\r\n    _ = TypedState(base=\"str\")\r\n```\r\n\r\n\r\n**Expected behavior**\r\nno errror\r\n\r\n**Specifics (please complete the following information):**\r\n - Python Version: 3.13\r\n - Reflex Version: main branch\r\n - OS: arch\r\n\r\n\n","issue_title":"rx.Field pydantic validation issues","labels":["fail_to_pass_count:1","live","pass_to_pass_count:2795","repo:reflex-dev/reflex"],"language":"python","official_test_entrypoint":"python -m swebench.harness.run_evaluation --instance_ids reflex-dev__reflex-4256 --dataset_name SWE-bench-Live","repo_name":"reflex-dev/reflex","schema_version":1,"source_url":"https://huggingface.co/datasets/SWE-bench/SWE-bench-Live","task_id":"reflex-dev__reflex-4256"}
