{"base_commit":"28d913d3cead6c5646307ffa6540b21d65059dfd","benchmark_id":"swe_bench_verified","created_at":"2019-01-20T06:08:26Z","environment_ref":"swebench/sweb.eval.x86_64.sympy__sympy-15809:latest","issue_id":"15809","issue_text":"Zero-argument Min() and Max()\nRight now `Min()` and `Max()` with no arguments raise `ValueError: The Max/Min functions must have arguments.`. It might be mathematically more convenient to have them return `oo` and `-oo`, respectively. See https://en.wikipedia.org/wiki/Empty_set#Extended_real_numbers for why these are valid answers mathematically. \n","issue_title":"Zero-argument Min() and Max()","labels":["env_setup_commit:73b3f90093754c5ed1561bd885242330e3583004","fail_to_pass_count:2","pass_to_pass_count:10","upstream_version:1.4"],"language":"python","official_test_entrypoint":"python -m pytest test_Max test_Min","repo_name":"sympy/sympy","schema_version":1,"source_url":"https://huggingface.co/datasets/princeton-nlp/SWE-bench_Verified","task_id":"sympy__sympy-15809"}
