{"base_commit":"ad3b3354e4e57bc0ac4d8cd9b7748adb1d2034ed","benchmark_id":"swe_bench_live","created_at":"2024-10-15T07:07:38Z","environment_ref":"starryzhang/sweb.eval.x86_64.beeware_1776_briefcase-2035","issue_id":"2035","issue_text":"Requires-python checks don't work with pre-release Python versions\n### Describe the bug\r\n\r\n#2029 added support for PEP 621 `requires-python` declarations. However, these version checks appear to *always* fail if the Python version is a prerelease.\r\n\r\n### Steps to reproduce\r\n\r\n1. Use a prerelease Python (e.g. 3.13.0.rc2, or 3.14.0a1)\r\n2. Run the Briefcase test suite.\r\n\r\nIn [this CI run](https://github.com/beeware/briefcase/actions/runs/11339866353/job/31535352956), using Python 3.14.0a1, there are 4 test failures:\r\n```\r\n=========================== short test summary info ============================\r\nFAILED tests/commands/base/test_verify_requires_python.py::test_requires_python_met[!= 3.2] - briefcase.exceptions.UnsupportedPythonVersion: Unable to run Briefcase command. The project configuration requires Python versions != 3.2, but the environment's Python version is 3.14.0a0. Please run Briefcase using a Python version that satisfies the project's requirements.\r\nFAILED tests/commands/base/test_verify_requires_python.py::test_requires_python_met[>= 3.2] - briefcase.exceptions.UnsupportedPythonVersion: Unable to run Briefcase command. The project configuration requires Python versions >= 3.2, but the environment's Python version is 3.14.0a0. Please run Briefcase using a Python version that satisfies the project's requirements.\r\nFAILED tests/commands/base/test_verify_requires_python.py::test_requires_python_met[> 3.2] - briefcase.exceptions.UnsupportedPythonVersion: Unable to run Briefcase command. The project configuration requires Python versions > 3.2, but the environment's Python version is 3.14.0a0. Please run Briefcase using a Python version that satisfies the project's requirements.\r\nFAILED tests/commands/base/test_verify_requires_python.py::test_requires_python_met[< 3.100] - briefcase.exceptions.UnsupportedPythonVersion: Unable to run Briefcase command. The project configuration requires Python versions < 3.100, but the environment's Python version is 3.14.0a0. Please run Briefcase using a Python version that satisfies the project's requirements.\r\n```\r\n\r\n\r\n### Expected behavior\r\n\r\n3.14.0a1 should pass `requires-python` checks that require `!=3.2`, `>3.2`, and `<3.100`.\r\n\r\n### Screenshots\r\n\r\n_No response_\r\n\r\n### Environment\r\n\r\n- Operating System: Any\r\n- Python version: Any pre-release version (3.14.0a1 tested)\r\n- Software versions:\r\n  - Briefcase: 0.3.20+\r\n\r\n\r\n### Logs\r\n\r\n```\r\n\r\n```\r\n\r\n\r\n### Additional context\r\n\r\nThis came up in the context of trying to add Python 3.14 to Briefcase's CI matrix.\n","issue_title":"Requires-python checks don't work with pre-release Python versions","labels":["fail_to_pass_count:1","live","pass_to_pass_count:2961","repo:beeware/briefcase"],"language":"python","official_test_entrypoint":"python -m pytest tests/commands/base/test_verify_requires_python.py::test_requires_python_prerelease","repo_name":"beeware/briefcase","schema_version":1,"source_url":"https://huggingface.co/datasets/SWE-bench/SWE-bench-Live","task_id":"beeware__briefcase-2035"}
