{"base_commit":"abb81878fd114f309297b35e1d392bee0d196fbf","benchmark_id":"swe_bench_live","created_at":"2025-02-20T12:29:48Z","environment_ref":"starryzhang/sweb.eval.x86_64.pylint-dev_1776_pylint-10240","issue_id":"10240","issue_text":"conditional import X.Y causes false positive possibly-used-before-assignment\n### Bug description\n\n```python\nif input():\n    import os.path\nelse:\n    os = None\nif os:\n    pass\n```\n\n### Command used\n\n```console\n$ pylint -E condimport.py \n```\n\n### Pylint output\n\n```\ncondimport.py:5:3: E0606: Possibly using variable 'os' before assignment (possibly-used-before-assignment)\n```\n\n### Expected behavior\n\nThe `os` variable is set in both branches, so no error should be reported.\n\n### Pylint version\n\n```\npylint 3.3.1\nastroid 3.3.5\nPython 3.13.0 (main, Oct  8 2024, 08:51:27) [GCC 9.4.0]\n```\n","issue_title":"conditional import X.Y causes false positive possibly-used-before-assignment","labels":["fail_to_pass_count:1","live","pass_to_pass_count:1905","repo:pylint-dev/pylint"],"language":"python","official_test_entrypoint":"python -m pytest tests/test_functional.py::test_functional","repo_name":"pylint-dev/pylint","schema_version":1,"source_url":"https://huggingface.co/datasets/SWE-bench/SWE-bench-Live","task_id":"pylint-dev__pylint-10240"}
