{"base_commit":"3c6f9a5a55b79563e32c766a1b5409e1d20b3601","benchmark_id":"swe_bench_live","created_at":"2024-12-10T09:56:32Z","environment_ref":"starryzhang/sweb.eval.x86_64.kozea_1776_weasyprint-2326","issue_id":"2326","issue_text":"Table overflow issue\nThis was tested in `WeasyPrint version 62.3` and `WeasyPrint version 63.0`.\nThis happens when `overflow-wrap` is set to `break-word` or `normal`. `anywhere` seems to work fine.\n\nInput:\n```\n<!DOCTYPE html>\n<html lang=\"en\">\n<head>\n  <meta charset=\"UTF-8\">\n  <meta name=\"viewport\" content=\"width=device-width initial-scale=1.0\">\n  <title>Table with Links</title>\n  <style>\n    table {\n      width: 100%;\n      max-width: 10px;\n      border: 1px solid black;\n      overflow-wrap: break-word; /* or normal */\n    }\n\n    th td {\n      border: 1px solid black;\n      padding: 8px;\n      text-align: left;\n    }\n\n    a {\n      margin-right: 8px;\n      text-decoration: none;\n      color: blue;\n    }\n  </style>\n</head>\n<body>\n  <h1>Example 1</h1>\n  <table>\n    <thead>\n      <tr>\n        <th>Header 1</th>\n        <th>Header 2</th>\n        <th>Header 3</th>\n        <th>Links</th>\n      </tr>\n    </thead>\n    <tbody>\n      <tr>\n        <td>Data foooooooooobar</td>\n        <td>Data foooooooooobar</td>\n        <td>Data foooooooooobar</td>\n        <td>\n          <a href=\"https://example.org\">123.456.78</a>,\n          <a href=\"https://example.org\">234.567.89</a>,\n          <a href=\"https://example.org\">345.678.90</a>\n        </td>\n      </tr>\n    </tbody>\n  </table>\n  <h1>Example 2</h1>\n  <table>\n    <thead>\n      <tr>\n        <th>Header 1</th>\n        <th>Header 2</th>\n        <th>Header 3</th>\n        <th>Links</th>\n      </tr>\n    </thead>\n    <tbody>\n      <tr>\n        <td>Data foooooooooobar</td>\n        <td>Data foooooooooobar</td>\n        <td>Data foooooooooobar</td>\n        <td>\n          <a href=\"https://example.org\">foooooobar</a>,\n          <a href=\"https://example.org\">foooooobar</a>,\n          <a href=\"https://example.org\">foooooobar</a>\n        </td>\n      </tr>\n    </tbody>\n  </table>\n  <h1>Example 3</h1>\n  <table>\n    <thead>\n      <tr>\n        <th>Header 1</th>\n        <th>Header 2</th>\n        <th>Header 3</th>\n        <th>Links</th>\n      </tr>\n    </thead>\n    <tbody>\n      <tr>\n        <td>Data foooooooooobar</td>\n        <td>Data foooooooooobar</td>\n        <td>Data foooooooooobar</td>\n        <td>\n          <a href=\"https://example.org\">S 123.456.78</a>,\n          <a href=\"https://example.org\">S 234.567.89</a>,\n          <a href=\"https://example.org\">S 345.678.90</a>\n        </td>\n      </tr>\n    </tbody>\n  </table>\n  <h1>Example 3</h1>\n  <table>\n    <thead>\n      <tr>\n        <th>Header 1</th>\n        <th>Header 2</th>\n        <th>Header 3</th>\n        <th>Links</th>\n      </tr>\n    </thead>\n    <tbody>\n      <tr>\n        <td>Data foooooooooobar</td>\n        <td>Data foooooooooobar</td>\n        <td>Data foooooooooobar</td>\n        <td>\n          <a href=\"https://example.org\">S foooooobar</a>,\n          <a href=\"https://example.org\">S foooooobar</a>,\n          <a href=\"https://example.org\">S foooooobar</a>\n        </td>\n      </tr>\n    </tbody>\n  </table>\n</body>\n</html>\n\n\n```\n\nWeasyprint PDF rendering:\n![Image](https://github.com/user-attachments/assets/f41b826d-e3d5-496d-a370-5bbf977bc1a8)\n\nFirefox rendering:\n![Image](https://github.com/user-attachments/assets/c0a20b66-adc1-4887-bff3-d79675475049)\n","issue_title":"Table overflow issue","labels":["fail_to_pass_count:1","live","pass_to_pass_count:2705","repo:Kozea/WeasyPrint"],"language":"python","official_test_entrypoint":"python -m swebench.harness.run_evaluation --instance_ids kozea__weasyprint-2326 --dataset_name SWE-bench-Live","repo_name":"Kozea/WeasyPrint","schema_version":1,"source_url":"https://huggingface.co/datasets/SWE-bench/SWE-bench-Live","task_id":"kozea__weasyprint-2326"}
