{"base_commit":"b6177f0459044a7e3fb882ecda9c80e44e4d95de","benchmark_id":"rust_swe_bench","created_at":"2026-04-22T06:05:19.413922700Z","environment_ref":"cargo://BurntSushi/ripgrep@b6177f045904","issue_id":"BurntSushi__ripgrep_727","issue_text":"Suggest --fixed-strings on invalid regexps\n```\r\n$ rg \"foo(\"\r\nError parsing regex near 'foo(' at character offset 3: Unclosed parenthesis.\r\n```\r\n\r\nI think ripgrep should suggest the `--fixed-strings` argument if there's a regex syntax error.","issue_title":"Suggest --fixed-strings on invalid regexps","labels":["repo:BurntSushi/ripgrep","rust"],"language":"rust","official_test_entrypoint":"cargo test --workspace --locked","repo_name":"BurntSushi/ripgrep","schema_version":1,"source_url":"https://huggingface.co/datasets/bytedance/Rust-SWE-bench","task_id":"BurntSushi__ripgrep_727"}
