{"base_commit":"466920f6d726eee90d5566e0a9948e92b33a122e","benchmark_id":"swe_bench_verified","created_at":"2021-02-18T13:05:27Z","environment_ref":"swebench/sweb.eval.x86_64.django__django-14017:latest","issue_id":"14017","issue_text":"Q(...) & Exists(...) raises a TypeError\nDescription\n\t\nExists(...) & Q(...) works, but Q(...) & Exists(...) raise a TypeError\nHere's a minimal example:\nIn [3]: Exists(Product.objects.all()) & Q()\nOut[3]: <Q: (AND: <django.db.models.expressions.Exists object at 0x7fc18dd0ed90>, (AND: ))>\nIn [4]: Q() & Exists(Product.objects.all())\n---------------------------------------------------------------------------\nTypeError\t\t\t\t\t\t\t\t Traceback (most recent call last)\n<ipython-input-4-21d3dea0fcb9> in <module>\n----> 1 Q() & Exists(Product.objects.all())\n~/Code/venv/ecom/lib/python3.8/site-packages/django/db/models/query_utils.py in __and__(self, other)\n\t 90 \n\t 91\t def __and__(self, other):\n---> 92\t\t return self._combine(other, self.AND)\n\t 93 \n\t 94\t def __invert__(self):\n~/Code/venv/ecom/lib/python3.8/site-packages/django/db/models/query_utils.py in _combine(self, other, conn)\n\t 71\t def _combine(self, other, conn):\n\t 72\t\t if not isinstance(other, Q):\n---> 73\t\t\t raise TypeError(other)\n\t 74 \n\t 75\t\t # If the other Q() is empty, ignore it and just use `self`.\nTypeError: <django.db.models.expressions.Exists object at 0x7fc18dd21400>\nThe & (and |) operators should be commutative on Q-Exists pairs, but it's not\nI think there's a missing definition of __rand__ somewhere.\n","issue_title":"Q(...) & Exists(...) raises a TypeError","labels":["env_setup_commit:475cffd1d64c690cdad16ede4d5e81985738ceb4","fail_to_pass_count:2","pass_to_pass_count:147","upstream_version:4.0"],"language":"python","official_test_entrypoint":"python -m swebench.harness.run_evaluation --instance_ids django__django-14017","repo_name":"django/django","schema_version":1,"source_url":"https://huggingface.co/datasets/princeton-nlp/SWE-bench_Verified","task_id":"django__django-14017"}
