{"base_commit":"838e432e3e5519c5383d12018e6c78f8ec7833c1","benchmark_id":"swe_bench_verified","created_at":"2019-01-21T00:22:36Z","environment_ref":"swebench/sweb.eval.x86_64.django__django-10880:latest","issue_id":"10880","issue_text":"Query syntax error with condition and distinct combination\nDescription\n\t\nA Count annotation containing both a Case condition and a distinct=True param produces a query error on Django 2.2 (whatever the db backend). A space is missing at least (... COUNT(DISTINCTCASE WHEN ...).\n","issue_title":"Query syntax error with condition and distinct combination","labels":["env_setup_commit:419a78300f7cd27611196e1e464d50fd0385ff27","fail_to_pass_count:1","pass_to_pass_count:55","upstream_version:3.0"],"language":"python","official_test_entrypoint":"python -m swebench.harness.run_evaluation --instance_ids django__django-10880","repo_name":"django/django","schema_version":1,"source_url":"https://huggingface.co/datasets/princeton-nlp/SWE-bench_Verified","task_id":"django__django-10880"}
